"priority","long_name","units","description","comment","name","standard_name","cell_methods","positive","type","dimensions","out_name","modeling_realm","frequency","cell_measures","prov","provNote","rowIndex","vid","MIPs (requesting)","MIPs (by experiment)","uid","AWI","CNRM","CMCC","ECEarth","MPI","METOFFICE","MO_key","STASH"
"1","sea-ice mass change through surface melting","kg m-2 s-1","The rate of change of sea ice mass through melting at the ice surface divided by grid-cell area",,"sidmassmelttop","tendency_of_sea_ice_amount_due_to_surface_melting","time: mean area: mean where sea_ice over sea",,,"longitude latitude time","sidmassmelttop","seaIce","mon","area: areacello","SIMIP [seaicemon]",,"40","59179aee-9e49-11e5-803c-0d0b866b59f3","C4MIP,FAFMIP,GMMIP,GeoMIP,HighResMIP,RFMIP,SIMIP","C4MIP,CMIP6,DAMIP,DCPP,DECK,FAFMIP,GMMIP,GeoMIP,HighResMIP,LS3MIP,LUMIP,OMIP,PMIP,RFMIP,ScenarioMIP","0b0d7456-00a8-11e6-ab7d-5404a60d96b5","False","False","x","False","False","CICE:1","lo-la-ti_a:m-seaice_sidmassmelttop","Structure not defined"
"1","sea-ice mass change through bottom melting","kg m-2 s-1","The rate of change of sea ice mass through melting at the ice bottom divided by grid-cell area",,"sidmassmeltbot","tendency_of_sea_ice_amount_due_to_basal_melting","time: mean area: mean where sea_ice over sea",,,"longitude latitude time","sidmassmeltbot","seaIce","mon","area: areacello","SIMIP [seaicemon]",,"41","5917ea6c-9e49-11e5-803c-0d0b866b59f3","C4MIP,FAFMIP,GMMIP,GeoMIP,HighResMIP,RFMIP,SIMIP","C4MIP,CMIP6,DAMIP,DCPP,DECK,FAFMIP,GMMIP,GeoMIP,HighResMIP,LS3MIP,LUMIP,OMIP,PMIP,RFMIP,ScenarioMIP","0b0d79e2-00a8-11e6-ab7d-5404a60d96b5","False","False","x","False","False","CICE:1","lo-la-ti_a:m-seaice_sidmassmeltbot","Structure not defined"
"2","Lateral sea ice melt rate","kg m-2 s-1","The rate of change of sea ice mass through lateral melting divided by grid-cell area (report 0 if not explicitly calculated thermodynamically)",,"sidmasslat","tendency_of_sea_ice_amount_due_to_lateral_melting","time: mean area: mean where sea_ice over sea",,,"longitude latitude time","sidmasslat","seaIce","mon","area: areacella","SIMIP [seaicemon]",,"42","590ea5c4-9e49-11e5-803c-0d0b866b59f3","C4MIP,FAFMIP,GMMIP,GeoMIP,HighResMIP,RFMIP,SIMIP","C4MIP,CMIP6,DAMIP,DCPP,DECK,FAFMIP,GMMIP,GeoMIP,HighResMIP,LS3MIP,LUMIP,OMIP,PMIP,RFMIP,ScenarioMIP","0b0d7fd2-00a8-11e6-ab7d-5404a60d96b5","False","False","x","False","False","False","lo-la-ti_a:m-seaice_sidmasslat","Structure not defined"
"2","snow mass change through snow fall","kg m-2 s-1","mass of solid precipitation falling onto sea ice divided by grid-cell area",,"sndmasssnf","snowfall_flux","time: mean area: mean where sea_ice over sea",,,"longitude latitude time","sndmasssnf","seaIce","mon","area: areacello","SIMIP [seaicemon]",,"43","59142a3a-9e49-11e5-803c-0d0b866b59f3","C4MIP,FAFMIP,GMMIP,GeoMIP,HighResMIP,RFMIP,SIMIP","C4MIP,CMIP6,DAMIP,DCPP,DECK,FAFMIP,GMMIP,GeoMIP,HighResMIP,LS3MIP,LUMIP,OMIP,PMIP,RFMIP,ScenarioMIP","0b0d85d6-00a8-11e6-ab7d-5404a60d96b5","False","False","False","False","False","False","lo-la-ti_a:m-seaice_sndmasssnf","Structure not defined"
"2","snow mass change through melt","kg m-2 s-1","the rate of change of snow mass through melt divided by grid-cell area",,"sndmassmelt","surface_snow_melt_flux","time: mean area: mean where sea_ice over sea",,,"longitude latitude time","sndmassmelt","seaIce","mon","area: areacello","SIMIP [seaicemon]",,"44","590e1ef6-9e49-11e5-803c-0d0b866b59f3","C4MIP,FAFMIP,GMMIP,GeoMIP,HighResMIP,RFMIP,SIMIP","C4MIP,CMIP6,DAMIP,DCPP,DECK,FAFMIP,GMMIP,GeoMIP,HighResMIP,LS3MIP,LUMIP,OMIP,PMIP,RFMIP,ScenarioMIP","0b0d8c5c-00a8-11e6-ab7d-5404a60d96b5","False","False","False","False","False","False","lo-la-ti_a:m-seaice_sndmassmelt","Structure not defined"
"2","snow mass change through evaporation or sublimation","kg m-2 s-1","the rate of change of snow mass through sublimation and evaporation divided by grid-cell area",,"sndmasssubl","surface_snow_sublimation_flux","time: mean area: mean where sea_ice over sea",,,"longitude latitude time","sndmasssubl","seaIce","mon","area: areacella","SIMIP [seaicemon]",,"45","590de2ce-9e49-11e5-803c-0d0b866b59f3","C4MIP,FAFMIP,GMMIP,GeoMIP,HighResMIP,RFMIP,SIMIP","C4MIP,CMIP6,DAMIP,DCPP,DECK,FAFMIP,GMMIP,GeoMIP,HighResMIP,LS3MIP,LUMIP,OMIP,PMIP,RFMIP,ScenarioMIP","0b0d91e8-00a8-11e6-ab7d-5404a60d96b5","False","False","False","False","False","False","lo-la-ti_a:m-seaice_sndmasssubl","Structure not defined"
"2","snow mass change through advection by sea-ice dynamics","kg m-2 s-1","the rate of change of snow mass through advection with sea ice divided by grid-cell area",,"sndmassdyn","tendency_of_snow_mass_due_to_sea_ice_dynamics","time: mean area: mean where sea_ice over sea",,,"longitude latitude time","sndmassdyn","seaIce","mon","area: areacella","SIMIP [seaicemon]",,"46","59139246-9e49-11e5-803c-0d0b866b59f3","C4MIP,FAFMIP,GMMIP,GeoMIP,HighResMIP,RFMIP,SIMIP","C4MIP,CMIP6,DAMIP,DCPP,DECK,FAFMIP,GMMIP,GeoMIP,HighResMIP,LS3MIP,LUMIP,OMIP,PMIP,RFMIP,ScenarioMIP","0b0d98be-00a8-11e6-ab7d-5404a60d96b5","False","False","False","False","False","False","lo-la-ti_a:m-seaice_sndmassdyn","Structure not defined"
"2","snow mass change through snow-to-ice conversion","kg m-2 s-1","the rate of change of snow mass due to transformation of snow to sea ice divided by grid-cell area",,"sndmasssi","tendency_of_snow_mass_due_to_snow_to_ice_conversion","time: mean area: mean where sea_ice over sea",,,"longitude latitude time","sndmasssi","seaIce","mon","area: areacella","SIMIP [seaicemon]",,"47","5914c95e-9e49-11e5-803c-0d0b866b59f3","C4MIP,FAFMIP,GMMIP,GeoMIP,HighResMIP,RFMIP,SIMIP","C4MIP,CMIP6,DAMIP,DCPP,DECK,FAFMIP,GMMIP,GeoMIP,HighResMIP,LS3MIP,LUMIP,OMIP,PMIP,RFMIP,ScenarioMIP","0b0d9e2c-00a8-11e6-ab7d-5404a60d96b5","False","False","False","False","False","False","lo-la-ti_a:m-seaice_sndmasssi","Structure not defined"
"2","snow mass change through wind drift of snow","kg m-2 s-1","the rate of change of snow mass through wind drift of snow divided by grid-cell area",,"sndmasswindrif","tendency_of_snow_mass_due_to_drifting_snow","time: mean area: mean where sea_ice over sea",,,"longitude latitude time","sndmasswindrif","seaIce","mon","area: areacella","SIMIP [seaicemon]",,"48","590d7370-9e49-11e5-803c-0d0b866b59f3","C4MIP,FAFMIP,GMMIP,GeoMIP,HighResMIP,RFMIP,SIMIP","C4MIP,CMIP6,DAMIP,DCPP,DECK,FAFMIP,GMMIP,GeoMIP,HighResMIP,LS3MIP,LUMIP,OMIP,PMIP,RFMIP,ScenarioMIP","0b0da386-00a8-11e6-ab7d-5404a60d96b5","False","False","False","False","False","False","lo-la-ti_a:m-seaice_sndmasswindrif","Structure not defined"
"1","Downwelling shortwave flux over sea ice","W m-2","the downwelling shortwave flux over sea ice (always positive by sign convention)",,"siflswdtop","surface_downwelling_shortwave_flux_in_air","time: mean where sea_ice area: mean where sea_ice area: mean where sea_ice",,,"longitude latitude time","siflswdtop","seaIce","mon","area: areacello","SIMIP [seaicemon]",,"49","590f2f8a-9e49-11e5-803c-0d0b866b59f3","C4MIP,FAFMIP,GMMIP,GeoMIP,HighResMIP,RFMIP,SIMIP","C4MIP,CMIP6,DAMIP,DCPP,DECK,FAFMIP,GMMIP,GeoMIP,HighResMIP,LS3MIP,LUMIP,OMIP,PMIP,RFMIP,ScenarioMIP","0b0daa7a-00a8-11e6-ab7d-5404a60d96b5","False","False","x","False","False","JULES:1","lo-la-ti_a:m-seaice_siflswdtop","Structure not defined"
"1","Upward shortwave flux over sea ice","W m-2","the upward shortwave flux over sea ice (always negative)",,"siflswutop","surface_upwelling_shortwave_flux_in_air","time: mean where sea_ice area: mean where sea_ice area: mean where sea_ice",,,"longitude latitude time","siflswutop","seaIce","mon","area: areacello","SIMIP [seaicemon]",,"50","5917e51c-9e49-11e5-803c-0d0b866b59f3","C4MIP,FAFMIP,GMMIP,GeoMIP,HighResMIP,RFMIP,SIMIP","C4MIP,CMIP6,DAMIP,DCPP,DECK,FAFMIP,GMMIP,GeoMIP,HighResMIP,LS3MIP,LUMIP,OMIP,PMIP,RFMIP,ScenarioMIP","0b0db02e-00a8-11e6-ab7d-5404a60d96b5","False","False","False","False","False","JULES:1","lo-la-ti_a:m-seaice_siflswutop","Structure not defined"
"1","Downwelling shortwave flux under sea ice","W m-2","the downwelling shortwave flux underneath sea ice (always positive)",,"siflswdbot","bottom_downwelling_shortwave_flux_into_ocean","time: mean where sea_ice area: mean where sea_ice area: mean where sea_ice",,,"longitude latitude time","siflswdbot","seaIce","mon","area: areacella","SIMIP [seaicemon]",,"51","590f5672-9e49-11e5-803c-0d0b866b59f3","C4MIP,FAFMIP,GMMIP,GeoMIP,HighResMIP,RFMIP,SIMIP","C4MIP,CMIP6,DAMIP,DCPP,DECK,FAFMIP,GMMIP,GeoMIP,HighResMIP,LS3MIP,LUMIP,OMIP,PMIP,RFMIP,ScenarioMIP","0b0db7ea-00a8-11e6-ab7d-5404a60d96b5","False","False","x","False","False","CICE:1","lo-la-ti_a:m-seaice_siflswdbot","Structure not defined"
"1","Downwelling longwave flux over sea ice","W m-2","the downwelling longwave flux over sea ice (always positive)",,"sifllwdtop","surface_downwelling_longwave_flux_in_air","time: mean where sea_ice area: mean where sea_ice area: mean where sea_ice",,,"longitude latitude time","sifllwdtop","seaIce","mon","area: areacello","SIMIP [seaicemon]",,"52","590e9656-9e49-11e5-803c-0d0b866b59f3","C4MIP,FAFMIP,GMMIP,GeoMIP,HighResMIP,RFMIP,SIMIP","C4MIP,CMIP6,DAMIP,DCPP,DECK,FAFMIP,GMMIP,GeoMIP,HighResMIP,LS3MIP,LUMIP,OMIP,PMIP,RFMIP,ScenarioMIP","0b0dbe0c-00a8-11e6-ab7d-5404a60d96b5","False","False","x","False","False","JULES:1","lo-la-ti_a:m-seaice_sifllwdtop","Structure not defined"
"1","Upward longwave flux over sea ice","W m-2","the upward longwave flux over sea ice (always negative)",,"sifllwutop","surface_upwelling_longwave_flux_in_air","time: mean where sea_ice area: mean where sea_ice area: mean where sea_ice",,,"longitude latitude time","sifllwutop","seaIce","mon","area: areacello","SIMIP [seaicemon]",,"53","591733d8-9e49-11e5-803c-0d0b866b59f3","C4MIP,FAFMIP,GMMIP,GeoMIP,HighResMIP,RFMIP,SIMIP","C4MIP,CMIP6,DAMIP,DCPP,DECK,FAFMIP,GMMIP,GeoMIP,HighResMIP,LS3MIP,LUMIP,OMIP,PMIP,RFMIP,ScenarioMIP","0b0dc320-00a8-11e6-ab7d-5404a60d96b5","False","False","False","False","False","JULES:1","lo-la-ti_a:m-seaice_sifllwutop","Structure not defined"
"1","Net sensible heat flux over sea ice","W m-2","the net sensible heat flux over sea ice",,"siflsenstop","surface_upward_sensible_heat_flux","time: mean where sea_ice area: mean where sea_ice area: mean where sea_ice",,,"longitude latitude time","siflsenstop","seaIce","mon","area: areacello","SIMIP [seaicemon]",,"54","590dbb78-9e49-11e5-803c-0d0b866b59f3","C4MIP,FAFMIP,GMMIP,GeoMIP,HighResMIP,RFMIP,SIMIP","C4MIP,CMIP6,DAMIP,DCPP,DECK,FAFMIP,GMMIP,GeoMIP,HighResMIP,LS3MIP,LUMIP,OMIP,PMIP,RFMIP,ScenarioMIP","0b0dc820-00a8-11e6-ab7d-5404a60d96b5","x","False","x","False","False","JULES:1","lo-la-ti_a:m-seaice_siflsenstop","Structure not defined"
"1","Net latent heat flux over sea ice","W m-2","the net latent heat flux over sea ice",,"sifllatstop","surface_upward_latent_heat_flux","time: mean where sea_ice area: mean where sea_ice area: mean where sea_ice",,,"longitude latitude time","sifllatstop","seaIce","mon","area: areacello","SIMIP [seaicemon]",,"55","59131140-9e49-11e5-803c-0d0b866b59f3","C4MIP,FAFMIP,GMMIP,GeoMIP,HighResMIP,RFMIP,SIMIP","C4MIP,CMIP6,DAMIP,DCPP,DECK,FAFMIP,GMMIP,GeoMIP,HighResMIP,LS3MIP,LUMIP,OMIP,PMIP,RFMIP,ScenarioMIP","0b0dcd16-00a8-11e6-ab7d-5404a60d96b5","x","False","x","False","False","CICE:1","lo-la-ti_a:m-seaice_sifllatstop","Structure not defined"
"1","Net sensible heat flux under sea ice","W m-2","the net sensible heat flux under sea ice from the ocean",,"siflsensupbot","ice_ocean_heat_flux","time: mean where sea_ice area: mean where sea_ice area: mean where sea_ice",,,"longitude latitude time","siflsensupbot","seaIce","mon","area: areacella","SIMIP [seaicemon]",,"56","590ef524-9e49-11e5-803c-0d0b866b59f3","C4MIP,FAFMIP,GMMIP,GeoMIP,HighResMIP,RFMIP,SIMIP","C4MIP,CMIP6,DAMIP,DCPP,DECK,FAFMIP,GMMIP,GeoMIP,HighResMIP,LS3MIP,LUMIP,OMIP,PMIP,RFMIP,ScenarioMIP","0b0dd284-00a8-11e6-ab7d-5404a60d96b5","False","False","False","False","False","CICE:1","lo-la-ti_a:m-seaice_siflsensupbot","Structure not defined"
"1","Net conductive heat flux in ice at the surface","W m-2","the net heat conduction flux at the ice surface",,"siflcondtop","conductive_heat_flux_at_sea_ice_surface","time: mean where sea_ice area: mean where sea_ice area: mean where sea_ice",,,"longitude latitude time","siflcondtop","seaIce","mon","area: areacella","SIMIP [seaicemon]",,"57","590ecbda-9e49-11e5-803c-0d0b866b59f3","C4MIP,FAFMIP,GMMIP,GeoMIP,HighResMIP,RFMIP,SIMIP","C4MIP,CMIP6,DAMIP,DCPP,DECK,FAFMIP,GMMIP,GeoMIP,HighResMIP,LS3MIP,LUMIP,OMIP,PMIP,RFMIP,ScenarioMIP","0b0dd7e8-00a8-11e6-ab7d-5404a60d96b5","x","False","False","False","False","CICE:1","lo-la-ti_a:m-seaice_siflcondtop","Structure not defined"
"1","Net conductive heat fluxes in ice at the bottom","W m-2","the net heat conduction flux at the ice base",,"siflcondbot","conductive_heat_flux_at_sea_ice_bottom","time: mean where sea_ice area: mean where sea_ice area: mean where sea_ice",,,"longitude latitude time","siflcondbot","seaIce","mon","area: areacella","SIMIP [seaicemon]",,"58","5917ba9c-9e49-11e5-803c-0d0b866b59f3","C4MIP,FAFMIP,GMMIP,GeoMIP,HighResMIP,RFMIP,SIMIP","C4MIP,CMIP6,DAMIP,DCPP,DECK,FAFMIP,GMMIP,GeoMIP,HighResMIP,LS3MIP,LUMIP,OMIP,PMIP,RFMIP,ScenarioMIP","0b0dde00-00a8-11e6-ab7d-5404a60d96b5","False","False","False","False","False","CICE:1","lo-la-ti_a:m-seaice_siflcondbot","Structure not defined"
"1","Rainfall rate over sea ice","kg m-2 s-1","mass of liquid precipitation falling onto sea ice divided by grid-cell area",,"sipr","rainfall_flux","time: mean where sea_ice area: mean where sea_ice area: mean where sea_ice",,,"longitude latitude time","sipr","seaIce","mon","area: areacello","SIMIP [seaicemon]",,"59","59138238-9e49-11e5-803c-0d0b866b59f3","C4MIP,FAFMIP,GMMIP,GeoMIP,HighResMIP,RFMIP,SIMIP","C4MIP,CMIP6,DAMIP,DCPP,DECK,FAFMIP,GMMIP,GeoMIP,HighResMIP,LS3MIP,LUMIP,OMIP,PMIP,RFMIP,ScenarioMIP","0b0de314-00a8-11e6-ab7d-5404a60d96b5","False","False","x","False","False","CICE:1","lo-la-ti_a:m-seaice_sipr","Structure not defined"
"1","Salt flux from sea ice","kg m-2 s-1","Total flux of salt from water into sea ice divided by grid-cell area; salt flux is upward (negative) during ice growth when salt is embedded into the ice and downward (positive) during melt when salt from sea ice is again released to the ocean",,"siflsaltbot","salt_flux_from_ice","time: mean where sea_ice area: mean where sea_ice area: mean where sea_ice",,,"longitude latitude time","siflsaltbot","seaIce","mon","area: areacella","SIMIP [seaicemon]",,"60","590eb730-9e49-11e5-803c-0d0b866b59f3","C4MIP,FAFMIP,GMMIP,GeoMIP,HighResMIP,RFMIP,SIMIP","C4MIP,CMIP6,DAMIP,DCPP,DECK,FAFMIP,GMMIP,GeoMIP,HighResMIP,LS3MIP,LUMIP,OMIP,PMIP,RFMIP,ScenarioMIP","0b0de882-00a8-11e6-ab7d-5404a60d96b5","False","False","x","False","x","CICE:1","lo-la-ti_a:m-seaice_siflsaltbot","Structure not defined"
"1","Freshwater flux from sea ice","kg m-2 s-1","Total flux of fresh water from water into sea ice divided by grid-cell area; This flux is negative during ice growth (liquid water mass decreases, hence upward flux of freshwater), positive during ice melt (liquid water mass increases, hence downward flux of freshwater)",,"siflfwbot","freshwater_flux_from_ice","time: mean where sea_ice area: mean where sea_ice area: mean where sea_ice",,,"longitude latitude time","siflfwbot","seaIce","mon","area: areacella","SIMIP [seaicemon]",,"61","590dce42-9e49-11e5-803c-0d0b866b59f3","C4MIP,FAFMIP,GMMIP,GeoMIP,HighResMIP,RFMIP,SIMIP","C4MIP,CMIP6,DAMIP,DCPP,DECK,FAFMIP,GMMIP,GeoMIP,HighResMIP,LS3MIP,LUMIP,OMIP,PMIP,RFMIP,ScenarioMIP","0b0dedf0-00a8-11e6-ab7d-5404a60d96b5","False","False","x","False","False","CICE:1","lo-la-ti_a:m-seaice_siflfwbot","Structure not defined"
"1","X-component of sea ice velocity","m s-1","x-velocity of ice on native model grid",,"siu","sea_ice_x_velocity","time: mean where sea_ice area: mean where sea_ice area: mean where sea_ice",,,"longitude latitude time","siu","seaIce","mon","area: areacella","SIMIP [seaicemon]",,"62","590e80c6-9e49-11e5-803c-0d0b866b59f3","C4MIP,DAMIP,FAFMIP,GMMIP,GeoMIP,HighResMIP,RFMIP,SIMIP","C4MIP,CMIP6,DAMIP,DCPP,DECK,FAFMIP,GMMIP,GeoMIP,HighResMIP,LS3MIP,LUMIP,OMIP,PMIP,RFMIP,ScenarioMIP","0b0df37c-00a8-11e6-ab7d-5404a60d96b5","x",3,"x","False","x","CICE:1","lo-la-ti_a:m-seaice_siu","Structure not defined"
"1","Y-component of sea ice velocity","m s-1","y-velocity of ice on native model grid",,"siv","sea_ice_y_velocity","time: mean where sea_ice area: mean where sea_ice area: mean where sea_ice",,,"longitude latitude time","siv","seaIce","mon","area: areacella","SIMIP [seaicemon]",,"63","59141748-9e49-11e5-803c-0d0b866b59f3","C4MIP,DAMIP,FAFMIP,GMMIP,GeoMIP,HighResMIP,RFMIP,SIMIP","C4MIP,CMIP6,DAMIP,DCPP,DECK,FAFMIP,GMMIP,GeoMIP,HighResMIP,LS3MIP,LUMIP,OMIP,PMIP,RFMIP,ScenarioMIP","0b0df872-00a8-11e6-ab7d-5404a60d96b5","x",3,"x","False","x","CICE:1","lo-la-ti_a:m-seaice_siv","Structure not defined"
"1","Sea-ice speed","m s-1","speed of ice (i.e. mean absolute velocity) to account for back-and-forth movement of the ice",,"sispeed","sea_ice_speed","time: mean where sea_ice area: mean where sea_ice area: mean where sea_ice",,,"longitude latitude time","sispeed","seaIce","mon","area: areacella","SIMIP [seaicemon]",,"64","590f4f2e-9e49-11e5-803c-0d0b866b59f3","C4MIP,DAMIP,FAFMIP,GMMIP,GeoMIP,HighResMIP,RFMIP,SIMIP","C4MIP,CMIP6,DAMIP,DCPP,DECK,FAFMIP,GMMIP,GeoMIP,HighResMIP,LS3MIP,LUMIP,OMIP,PMIP,RFMIP,ScenarioMIP","0b0dfde0-00a8-11e6-ab7d-5404a60d96b5","x","False","False","False","False","CICE:1","lo-la-ti_a:m-seaice_sispeed","Structure not defined"
"2","X-component of sea-ice mass transport","kg s-1","Includes transport of both sea ice and snow by advection",,"sidmasstranx","sea_ice_x_transport","time: mean area: mean where sea_ice over sea",,,"longitude latitude time","sidmasstranx","seaIce","mon","area: areacello","SIMIP [seaicemon]",,"65","59172e42-9e49-11e5-803c-0d0b866b59f3","C4MIP,FAFMIP,GMMIP,GeoMIP,HighResMIP,RFMIP,SIMIP","C4MIP,CMIP6,DAMIP,DCPP,DECK,FAFMIP,GMMIP,GeoMIP,HighResMIP,LS3MIP,LUMIP,OMIP,PMIP,RFMIP,ScenarioMIP","0b0e02ea-00a8-11e6-ab7d-5404a60d96b5","x","False","False","False","x","False","lo-la-ti_a:m-seaice_sidmasstranx","Structure not defined"
"2","Y-component of sea-ice mass transport","kg s-1","Includes transport of both sea ice and snow by advection",,"sidmasstrany","sea_ice_y_transport","time: mean area: mean where sea_ice over sea",,,"longitude latitude time","sidmasstrany","seaIce","mon","area: areacello","SIMIP [seaicemon]",,"66","59172bcc-9e49-11e5-803c-0d0b866b59f3","C4MIP,FAFMIP,GMMIP,GeoMIP,HighResMIP,RFMIP,SIMIP","C4MIP,CMIP6,DAMIP,DCPP,DECK,FAFMIP,GMMIP,GeoMIP,HighResMIP,LS3MIP,LUMIP,OMIP,PMIP,RFMIP,ScenarioMIP","0b0e07e0-00a8-11e6-ab7d-5404a60d96b5","x","False","False","False","x","False","lo-la-ti_a:m-seaice_sidmasstrany","Structure not defined"
"1","X-component of atmospheric stress on sea ice","N m-2","X-component of atmospheric stress on sea ice",,"sistrxdtop","surface_downward_x_stress","time: mean where sea_ice area: mean where sea_ice area: mean where sea_ice",,,"longitude latitude time","sistrxdtop","seaIce","mon","area: areacella","SIMIP [seaicemon]",,"67","5913f77c-9e49-11e5-803c-0d0b866b59f3","C4MIP,FAFMIP,GMMIP,GeoMIP,HighResMIP,RFMIP,SIMIP","C4MIP,CMIP6,DAMIP,DCPP,DECK,FAFMIP,GMMIP,GeoMIP,HighResMIP,LS3MIP,LUMIP,OMIP,PMIP,RFMIP,ScenarioMIP","0b0e0d44-00a8-11e6-ab7d-5404a60d96b5","x","False","x","False","x","CICE:1","lo-la-ti_a:m-seaice_sistrxdtop","Structure not defined"
"1","Y-component of atmospheric stress on sea ice","N m-2","Y-component of atmospheric stress on sea ice",,"sistrydtop","surface_downward_y_stress","time: mean where sea_ice area: mean where sea_ice area: mean where sea_ice",,,"longitude latitude time","sistrydtop","seaIce","mon","area: areacella","SIMIP [seaicemon]",,"68","591774d8-9e49-11e5-803c-0d0b866b59f3","C4MIP,FAFMIP,GMMIP,GeoMIP,HighResMIP,RFMIP,SIMIP","C4MIP,CMIP6,DAMIP,DCPP,DECK,FAFMIP,GMMIP,GeoMIP,HighResMIP,LS3MIP,LUMIP,OMIP,PMIP,RFMIP,ScenarioMIP","0b0e128a-00a8-11e6-ab7d-5404a60d96b5","x","False","x","False","x","CICE:1","lo-la-ti_a:m-seaice_sistrydtop","Structure not defined"
"1","X-component of ocean stress on sea ice","N m-2","X-component of ocean stress on sea ice",,"sistrxubot","sea_ice_base_upward_x_stress","time: mean where sea_ice area: mean where sea_ice area: mean where sea_ice",,,"longitude latitude time","sistrxubot","seaIce","mon","area: areacello","SIMIP [seaicemon]",,"69","590d2848-9e49-11e5-803c-0d0b866b59f3","C4MIP,FAFMIP,GMMIP,GeoMIP,HighResMIP,RFMIP,SIMIP","C4MIP,CMIP6,DAMIP,DCPP,DECK,FAFMIP,GMMIP,GeoMIP,HighResMIP,LS3MIP,LUMIP,OMIP,PMIP,RFMIP,ScenarioMIP","0b0e18b6-00a8-11e6-ab7d-5404a60d96b5","False","False","x","False","x","CICE:1","lo-la-ti_a:m-seaice_sistrxubot","Structure not defined"
"1","Y-component of ocean stress on sea ice","N m-2","Y-component of ocean stress on sea ice",,"sistryubot","sea_ice_base_upward_y_stress","time: mean where sea_ice area: mean where sea_ice area: mean where sea_ice",,,"longitude latitude time","sistryubot","seaIce","mon","area: areacello","SIMIP [seaicemon]",,"70","59150da6-9e49-11e5-803c-0d0b866b59f3","C4MIP,FAFMIP,GMMIP,GeoMIP,HighResMIP,RFMIP,SIMIP","C4MIP,CMIP6,DAMIP,DCPP,DECK,FAFMIP,GMMIP,GeoMIP,HighResMIP,LS3MIP,LUMIP,OMIP,PMIP,RFMIP,ScenarioMIP","0b0e1f96-00a8-11e6-ab7d-5404a60d96b5","False","False","x","False","x","CICE:1","lo-la-ti_a:m-seaice_sistryubot","Structure not defined"
"2","Compressive sea ice strength","N m-1","Computed strength of the ice pack, defined as the energy (J m-2) dissipated per unit area removed from the ice pack under compression, and assumed proportional to the change in potential energy caused by ridging. For Hibler-type models, this is P (= P*hexp(-C(1-A)))",,"sicompstren","compressive_strength_of_sea_ice","time: mean where sea_ice area: mean where sea_ice area: mean where sea_ice",,,"longitude latitude time","sicompstren","seaIce","mon","area: areacello","SIMIP [seaicemon]",,"71","590e9390-9e49-11e5-803c-0d0b866b59f3","C4MIP,FAFMIP,GMMIP,GeoMIP,HighResMIP,RFMIP,SIMIP","C4MIP,CMIP6,DAMIP,DCPP,DECK,FAFMIP,GMMIP,GeoMIP,HighResMIP,LS3MIP,LUMIP,OMIP,PMIP,RFMIP,ScenarioMIP","0b0e24aa-00a8-11e6-ab7d-5404a60d96b5","False","False","x","False","False","False","lo-la-ti_a:m-seaice_sicompstren","Structure not defined"
"3","Atmospheric drag coefficient","1.0","Atmospheric drag coefficient that is used to calculate the atmospheric momentum drag on sea ice",,"sidragtop","surface_drag_coefficient_for_momentum_in_air","time: mean where sea_ice area: mean where sea_ice area: mean where sea_ice",,,"longitude latitude time","sidragtop","seaIce","mon","area: areacella","SIMIP [seaicemon]",,"72","5914e0ba-9e49-11e5-803c-0d0b866b59f3","C4MIP,FAFMIP,GMMIP,GeoMIP,HighResMIP,RFMIP,SIMIP","C4MIP,CMIP6,DAMIP,DCPP,DECK,FAFMIP,GMMIP,GeoMIP,HighResMIP,LS3MIP,LUMIP,OMIP,PMIP,RFMIP,ScenarioMIP","0b0e2a18-00a8-11e6-ab7d-5404a60d96b5","False","False","False","False","False","False","lo-la-ti_a:m-seaice_sidragtop","Structure not defined"
"3","Ocean drag coefficient","1.0","Oceanic drag coefficient that is used to calculate the oceanic momentum drag on sea ice",,"sidragbot","surface_drag_coefficient_for_momentum_in_water","time: mean where sea_ice area: mean where sea_ice area: mean where sea_ice",,,"longitude latitude time","sidragbot","seaIce","mon","area: areacella","SIMIP [seaicemon]",,"73","590e9070-9e49-11e5-803c-0d0b866b59f3","C4MIP,FAFMIP,GMMIP,GeoMIP,HighResMIP,RFMIP,SIMIP","C4MIP,CMIP6,DAMIP,DCPP,DECK,FAFMIP,GMMIP,GeoMIP,HighResMIP,LS3MIP,LUMIP,OMIP,PMIP,RFMIP,ScenarioMIP","0b0e2f7c-00a8-11e6-ab7d-5404a60d96b5","False","False","False","False","False","False","lo-la-ti_a:m-seaice_sidragbot","Structure not defined"
"3","Sea-surface tilt term in force balance (x-component)","N m-2","X-component of force on sea ice caused by sea-surface tilt",,"siforcetiltx","sea_surface_tilt_force_on_sea_ice_x","time: mean where sea_ice area: mean where sea_ice area: mean where sea_ice",,,"longitude latitude time","siforcetiltx","seaIce","mon","area: areacella","SIMIP [seaicemon]",,"74","590ed33c-9e49-11e5-803c-0d0b866b59f3","C4MIP,FAFMIP,GMMIP,GeoMIP,HighResMIP,RFMIP,SIMIP","C4MIP,CMIP6,DAMIP,DCPP,DECK,FAFMIP,GMMIP,GeoMIP,HighResMIP,LS3MIP,LUMIP,OMIP,PMIP,RFMIP,ScenarioMIP","0b0e34d6-00a8-11e6-ab7d-5404a60d96b5","False","False","x","False","False","False","lo-la-ti_a:m-seaice_siforcetiltx","Structure not defined"
"3","Sea-surface tilt term in force balance (y-component)","N m-2","Y-component of force on sea ice caused by sea-surface tilt",,"siforcetilty","sea_surface_tilt_force_on_sea_ice_y","time: mean where sea_ice area: mean where sea_ice area: mean where sea_ice",,,"longitude latitude time","siforcetilty","seaIce","mon","area: areacella","SIMIP [seaicemon]",,"75","590d7654-9e49-11e5-803c-0d0b866b59f3","C4MIP,FAFMIP,GMMIP,GeoMIP,HighResMIP,RFMIP,SIMIP","C4MIP,CMIP6,DAMIP,DCPP,DECK,FAFMIP,GMMIP,GeoMIP,HighResMIP,LS3MIP,LUMIP,OMIP,PMIP,RFMIP,ScenarioMIP","0b0e3ca6-00a8-11e6-ab7d-5404a60d96b5","False","False","x","False","False","False","lo-la-ti_a:m-seaice_siforcetilty","Structure not defined"
"3","Coriolis force term in force balance (x-component)","N m-2","X-component of force on sea ice caused by coriolis force",,"siforcecoriolx","coriolis_force_on_sea_ice_x","time: mean where sea_ice area: mean where sea_ice area: mean where sea_ice",,,"longitude latitude time","siforcecoriolx","seaIce","mon","area: areacella","SIMIP [seaicemon]",,"76","590e3ee0-9e49-11e5-803c-0d0b866b59f3","C4MIP,FAFMIP,GMMIP,GeoMIP,HighResMIP,RFMIP,SIMIP","C4MIP,CMIP6,DAMIP,DCPP,DECK,FAFMIP,GMMIP,GeoMIP,HighResMIP,LS3MIP,LUMIP,OMIP,PMIP,RFMIP,ScenarioMIP","0b0e42a0-00a8-11e6-ab7d-5404a60d96b5","False","False","x","False","False","False","lo-la-ti_a:m-seaice_siforcecoriolx","Structure not defined"
