"priority","long_name","units","description","comment","name","standard_name","cell_methods","positive","type","dimensions","out_name","modeling_realm","frequency","cell_measures","prov","provNote","rowIndex","vid","MIPs (requesting)","MIPs (by experiment)","uid","AWI","CNRM","CMCC","ECEarth","MPI","METOFFICE","MO_key","STASH"
"3","Coriolis force term in force balance (y-component)","N m-2","Y-component of force on sea ice caused by coriolis force",,"siforcecorioly","coriolis_force_on_sea_ice_y","time: mean where sea_ice area: mean where sea_ice area: mean where sea_ice",,,"longitude latitude time","siforcecorioly","seaIce","mon","area: areacella","SIMIP [seaicemon]",,"77","590d4fc6-9e49-11e5-803c-0d0b866b59f3","C4MIP,FAFMIP,GMMIP,GeoMIP,HighResMIP,RFMIP,SIMIP","C4MIP,CMIP6,DAMIP,DCPP,DECK,FAFMIP,GMMIP,GeoMIP,HighResMIP,LS3MIP,LUMIP,OMIP,PMIP,RFMIP,ScenarioMIP","0b0e47fa-00a8-11e6-ab7d-5404a60d96b5","False","False","x","False","False","False","lo-la-ti_a:m-seaice_siforcecorioly","Structure not defined"
"1","Internal stress term in force balance (x-component)","N m-2","X-component of force on sea ice caused by internal stress (divergence of sigma)",,"siforceintstrx","internal_stress_in_sea_ice_x","time: mean where sea_ice area: mean where sea_ice area: mean where sea_ice",,,"longitude latitude time","siforceintstrx","seaIce","mon","area: areacella","SIMIP [seaicemon]",,"78","590df8a4-9e49-11e5-803c-0d0b866b59f3","C4MIP,FAFMIP,GMMIP,GeoMIP,HighResMIP,RFMIP,SIMIP","C4MIP,CMIP6,DAMIP,DCPP,DECK,FAFMIP,GMMIP,GeoMIP,HighResMIP,LS3MIP,LUMIP,OMIP,PMIP,RFMIP,ScenarioMIP","0b0e4f16-00a8-11e6-ab7d-5404a60d96b5","False","False","x","False","False","False","lo-la-ti_a:m-seaice_siforceintstrx","Structure not defined"
"1","Internal stress term in force balance (y-component)","N m-2","Y-component of force on sea ice caused by internal stress (divergence of sigma)",,"siforceintstry","internal_stress_in_sea_ice_y","time: mean where sea_ice area: mean where sea_ice area: mean where sea_ice",,,"longitude latitude time","siforceintstry","seaIce","mon","area: areacella","SIMIP [seaicemon]",,"79","590df5e8-9e49-11e5-803c-0d0b866b59f3","C4MIP,FAFMIP,GMMIP,GeoMIP,HighResMIP,RFMIP,SIMIP","C4MIP,CMIP6,DAMIP,DCPP,DECK,FAFMIP,GMMIP,GeoMIP,HighResMIP,LS3MIP,LUMIP,OMIP,PMIP,RFMIP,ScenarioMIP","0b0e5470-00a8-11e6-ab7d-5404a60d96b5","False","False","x","False","False","False","lo-la-ti_a:m-seaice_siforceintstry","Structure not defined"
"3","Average normal stress in sea ice","N m-1","Average normal stress in sea ice (first stress invariant)",,"sistresave","average_normal_stress","time: point area: mean where sea_ice",,,"longitude latitude time1","sistresave","seaIce","mon","area: areacella","SIMIP [seaicemon]",,"80","590e4bd8-9e49-11e5-803c-0d0b866b59f3","C4MIP,FAFMIP,GMMIP,GeoMIP,HighResMIP,RFMIP,SIMIP","C4MIP,CMIP6,DAMIP,DCPP,DECK,FAFMIP,GMMIP,GeoMIP,HighResMIP,LS3MIP,LUMIP,OMIP,PMIP,RFMIP,ScenarioMIP","0b0e5a88-00a8-11e6-ab7d-5404a60d96b5",,,,,,"False","lo-la-ti_a:m-seaice_sistresave","Structure not defined"
"3","Maximum shear stress in sea ice","N m-1","Maximum shear stress in sea ice (second stress invariant)",,"sistremax","maximum_shear_stress","time: point area: mean where sea_ice",,,"longitude latitude time1","sistremax","seaIce","mon","area: areacella","SIMIP [seaicemon]",,"81","590ea16e-9e49-11e5-803c-0d0b866b59f3","C4MIP,FAFMIP,GMMIP,GeoMIP,HighResMIP,RFMIP,SIMIP","C4MIP,CMIP6,DAMIP,DCPP,DECK,FAFMIP,GMMIP,GeoMIP,HighResMIP,LS3MIP,LUMIP,OMIP,PMIP,RFMIP,ScenarioMIP","0b0e5fe2-00a8-11e6-ab7d-5404a60d96b5",,,,,,"False","lo-la-ti_a:m-seaice_sistremax","Structure not defined"
"1","Divergence of the sea-ice velocity field","1/s","Divergence of sea-ice velocity field (first shear strain invariant)",,"sidivvel","divergence_of_sea_ice_velocity","time: point area: mean where sea_ice",,,"longitude latitude time1","sidivvel","seaIce","mon","area: areacello","SIMIP [seaicemon]",,"82","590d7924-9e49-11e5-803c-0d0b866b59f3","C4MIP,FAFMIP,GMMIP,GeoMIP,HighResMIP,RFMIP,SIMIP","C4MIP,CMIP6,DAMIP,DCPP,DECK,FAFMIP,GMMIP,GeoMIP,HighResMIP,LS3MIP,LUMIP,OMIP,PMIP,RFMIP,ScenarioMIP","0b0e64ec-00a8-11e6-ab7d-5404a60d96b5","False","False","x","False","False","CICE:1","lo-la-ti_a:m-seaice_sidivvel","Structure not defined"
"2","Maximum shear of sea-ice velocity field","1/s","Maximum shear of sea-ice velocity field (second shear strain invariant)",,"sishevel","maximum_shear_of_sea_ice_velocity","time: point area: mean where sea_ice",,,"longitude latitude time1","sishevel","seaIce","mon","area: areacella","SIMIP [seaicemon]",,"83","590d70b4-9e49-11e5-803c-0d0b866b59f3","C4MIP,FAFMIP,GMMIP,GeoMIP,HighResMIP,RFMIP,SIMIP","C4MIP,CMIP6,DAMIP,DCPP,DECK,FAFMIP,GMMIP,GeoMIP,HighResMIP,LS3MIP,LUMIP,OMIP,PMIP,RFMIP,ScenarioMIP","0b0e6ad2-00a8-11e6-ab7d-5404a60d96b5","False","False","False","False","False","False","lo-la-ti_a:m-seaice_sishevel","Structure not defined"
"2","Sea ice extent North","10^6 km2","Total area of all Northern-Hemisphere grid cells that are covered by at least 15 % areal fraction of sea ice",,"siextentn","sea_ice_extent","time: mean area: mean where sea_ice over sea",,,"time","siextentn","seaIce","mon","area: areacella","SIMIP [seaicemon]",,"84","5917b45c-9e49-11e5-803c-0d0b866b59f3","C4MIP,FAFMIP,GMMIP,GeoMIP,HighResMIP,RFMIP,SIMIP","C4MIP,CMIP6,DAMIP,DCPP,DECK,FAFMIP,GMMIP,GeoMIP,HighResMIP,LS3MIP,LUMIP,OMIP,PMIP,RFMIP,ScenarioMIP","0b0e7036-00a8-11e6-ab7d-5404a60d96b5","x","False","False","False","False","False","ti_a:m-seaice_siextentn","Structure not defined"
"2","Sea ice extent South","10^6 km2","Total area of all Southern-Hemisphere grid cells that are covered by at least 15 % areal fraction of sea ice",,"siextents","sea_ice_extent","time: mean area: mean where sea_ice over sea",,,"time","siextents","seaIce","mon","area: areacella","SIMIP [seaicemon]",,"85","590e9ed0-9e49-11e5-803c-0d0b866b59f3","C4MIP,FAFMIP,GMMIP,GeoMIP,HighResMIP,RFMIP,SIMIP","C4MIP,CMIP6,DAMIP,DCPP,DECK,FAFMIP,GMMIP,GeoMIP,HighResMIP,LS3MIP,LUMIP,OMIP,PMIP,RFMIP,ScenarioMIP","0b0e759a-00a8-11e6-ab7d-5404a60d96b5","x","False","False","False","False","False","ti_a:m-seaice_siextents","Structure not defined"
"2","Sea ice volume North","10^3 km3","total volume of sea ice in the Northern hemisphere",,"sivoln","sea_ice_volume","time: mean area: mean where sea_ice over sea",,,"time","sivoln","seaIce","mon","area: areacella","SIMIP [seaicemon]",,"86","5913c9aa-9e49-11e5-803c-0d0b866b59f3","C4MIP,FAFMIP,GMMIP,GeoMIP,HighResMIP,RFMIP,SIMIP","C4MIP,CMIP6,DAMIP,DCPP,DECK,FAFMIP,GMMIP,GeoMIP,HighResMIP,LS3MIP,LUMIP,OMIP,PMIP,RFMIP,ScenarioMIP","0b0e7d60-00a8-11e6-ab7d-5404a60d96b5","x","False","False","False","False","False","ti_a:m-seaice_sivoln","Structure not defined"
"2","Sea ice volume South","10^3 km3","total volume of sea ice in the Southern hemisphere",,"sivols","sea_ice_volume","time: mean area: mean where sea_ice over sea",,,"time","sivols","seaIce","mon","area: areacella","SIMIP [seaicemon]",,"87","590ee2fa-9e49-11e5-803c-0d0b866b59f3","C4MIP,FAFMIP,GMMIP,GeoMIP,HighResMIP,RFMIP,SIMIP","C4MIP,CMIP6,DAMIP,DCPP,DECK,FAFMIP,GMMIP,GeoMIP,HighResMIP,LS3MIP,LUMIP,OMIP,PMIP,RFMIP,ScenarioMIP","0b0e835a-00a8-11e6-ab7d-5404a60d96b5","x","False","False","False","False","False","ti_a:m-seaice_sivols","Structure not defined"
"2","Sea ice area North","10^6 km2","total area of sea ice in the Northern hemisphere",,"siarean","sea_ice_area","time: mean area: mean where sea_ice over sea",,,"time","siarean","seaIce","mon","area: areacella","SIMIP [seaicemon]",,"88","59139a70-9e49-11e5-803c-0d0b866b59f3","C4MIP,FAFMIP,GMMIP,GeoMIP,HighResMIP,RFMIP,SIMIP","C4MIP,CMIP6,DAMIP,DCPP,DECK,FAFMIP,GMMIP,GeoMIP,HighResMIP,LS3MIP,LUMIP,OMIP,PMIP,RFMIP,ScenarioMIP","0b0e88aa-00a8-11e6-ab7d-5404a60d96b5","x","False","False","False","False","False","ti_a:m-seaice_siarean","Structure not defined"
"2","Sea ice area South","10^6 km2","total area of sea ice in the Southern hemisphere",,"siareas","sea_ice_area","time: mean area: mean where sea_ice over sea",,,"time","siareas","seaIce","mon","area: areacella","SIMIP [seaicemon]",,"89","59139548-9e49-11e5-803c-0d0b866b59f3","C4MIP,FAFMIP,GMMIP,GeoMIP,HighResMIP,RFMIP,SIMIP","C4MIP,CMIP6,DAMIP,DCPP,DECK,FAFMIP,GMMIP,GeoMIP,HighResMIP,LS3MIP,LUMIP,OMIP,PMIP,RFMIP,ScenarioMIP","0b0e8de6-00a8-11e6-ab7d-5404a60d96b5","x","False","False","False","False","False","ti_a:m-seaice_siareas","Structure not defined"
"1","Sea ice mass flux through straits","kg/s","net (sum of transport in all directions) sea ice mass transport through the following four passages, positive into the Arctic Ocean 1. Fram Strait = (11.5oW,81.3oN to (10.5oE,79.6oN) 2. Canadian Archipelego = (128.2oW,70.6oN) to (59.3oW,82.1oN) 3. Barents opening = (16.8oE,76.5oN) to (19.2oE,70.2oN) 4. Bering Strait = (171oW,66.2oN) to (166oW,65oN)","Flux across 4 straits","siacrossline","sea_ice_transport_across_line","time: mean area: mean where sea_ice over sea",,,"latitude basin time","siacrossline","seaIce","mon","area: areacello","SIMIP [seaicemon]",,"90","5917e7a6-9e49-11e5-803c-0d0b866b59f3","C4MIP,FAFMIP,GMMIP,GeoMIP,HighResMIP,RFMIP,SIMIP","C4MIP,CMIP6,DAMIP,DCPP,DECK,FAFMIP,GMMIP,GeoMIP,HighResMIP,LS3MIP,LUMIP,OMIP,PMIP,RFMIP,ScenarioMIP","0b0e93ae-00a8-11e6-ab7d-5404a60d96b5","False","False","False","False","x","CICE:Postprocess?","la-b-ti_a:m-seaice_siacrossline","Structure not defined"
