0,"Omon",2,"Temperature Flux due to Runoff Expressed as Heat Flux into Sea Water","W m-2","None","In general this should be reported as a function of depth, (i.e.,  it will be a function of the generic ""XYZ"" dimensions).  Include enough depth levels to represent  the non-zero values of this field everywhere on the globe.","hfrunoffds","temperature_flux_due_to_runoff_expressed_as_heat_flux_into_sea_water","None","W m-2","time: mean area: mean where sea","None","None","None","None","None","real","longitude latitude olevel time","hfrunoffds","ocean","mon","area: areacello","None","None",2,""
0,"Omon",2,"Temperature Flux due to Runoff Expressed as Heat Flux into Sea Water","W m-2","None","If only the vertically integrated runoff flux is available, report as this 2-d field; otherwise the row above should be used.","hfrunoffds","temperature_flux_due_to_runoff_expressed_as_heat_flux_into_sea_water","None","W m-2","time: mean area: mean where sea","None","None","None","None","None","real","longitude latitude time","hfrunoffds2d","ocean","mon","area: areacello","None","None",2,""
0,"Omon",2,"Heat Flux into Sea Water due to Snow Thermodynamics","W m-2","None","In general this should be reported as a function of depth, (i.e.,  it will be a function of the generic ""XYZ"" dimensions).  Include enough depth levels to represent  the non-zero values of this field everywhere on the globe.","hfsnthermds","heat_flux_into_sea_water_due_to_snow_thermodynamics","None","W m-2","time: mean area: mean where sea","None","None","None","None","None","real","longitude latitude olevel time","hfsnthermds","ocean","mon","area: areacello","None","None",2,""
0,"Omon",2,"Heat Flux into Sea Water due to Snow Thermodynamics","W m-2","None","If only the vertically integrated heat flux is available, report as this 2-d field; otherwise the row above should be used.","hfsnthermds","heat_flux_into_sea_water_due_to_snow_thermodynamics","None","W m-2","time: mean area: mean where sea","None","None","None","None","None","real","longitude latitude time","hfsnthermds2d","ocean","mon","area: areacello","None","None",2,""
0,"Omon",2,"Heat Flux into Sea Water due to Iceberg Thermodynamics","W m-2","None","In general this should be reported as a function of depth, (i.e.,  it will be a function of the generic ""XYZ"" dimensions).  Include enough depth levels to represent  the non-zero values of this field everywhere on the globe.","hfibthermds","heat_flux_into_sea_water_due_to_iceberg_thermodynamics","None","W m-2","time: mean area: mean where sea","None","None","None","None","None","real","longitude latitude olevel time","hfibthermds","ocean","mon","area: areacello","None","None",2,""
0,"Omon",2,"Heat Flux into Sea Water due to Iceberg Thermodynamics","W m-2","None","If only the vertically integrated heat flux is available, report as this 2-d field; otherwise the row above should be used.","hfibthermds","heat_flux_into_sea_water_due_to_iceberg_thermodynamics","None","W m-2","time: mean area: mean where sea","None","None","None","None","None","real","longitude latitude time","hfibthermds2d","ocean","mon","area: areacello","None","None",2,""
0,"Omon",2,"Surface Net Downward Longwave Radiation","W m-2","This is defined as ""where ice_free_sea over sea""","None","rlds","surface_net_downward_longwave_flux","None","W m-2","time: mean area: mean where ice_free_sea over sea","None","None","None","None","down","real","longitude latitude time","rlds","ocean","mon","area: areacello","None","None",2,""
0,"Omon",2,"Surface Downward Latent Heat Flux","W m-2","This is defined as ""where ice_free_sea over sea""","None","hfls","surface_downward_latent_heat_flux","None","W m-2","time: mean area: mean where ice_free_sea over sea","None","None","None","None","down","real","longitude latitude time","hfls","ocean","mon","area: areacello","None","None",2,""
0,"Omon",2,"Surface Downward Sensible Heat Flux","W m-2","This is defined as ""where ice_free_sea over sea""","None","hfss","surface_downward_sensible_heat_flux","None","W m-2","time: mean area: mean where ice_free_sea over sea","None","None","None","None","down","real","longitude latitude time","hfss","ocean","mon","area: areacello","None","None",2,""
0,"Omon",2,"Net Downward Shortwave Radiation at Sea Water Surface","W m-2","This is the flux into the surface of liquid sea water only. This excludes shortwave flux absorbed by sea ice, but includes any light that passes through the ice and is absorbed by the ocean.","None","rsntds","net_downward_shortwave_flux_at_sea_water_surface","None","W m-2","time: mean area: mean where sea","None","None","None","None","down","real","longitude latitude time","rsntds","ocean","mon","area: areacello","None","None",2,""
0,"Omon",2,"Downwelling Shortwave Radiation in Sea Water","W m-2","None","In general the shortwave flux should be reported as a function of ocean depth, (i.e.,  it will be a function of the generic ""XYZ"" dimensions).  Include enough depth levels to represent  the non-zero values of this field everywhere on the globe.","rsdo","downwelling_shortwave_flux_in_sea_water","None","W m-2","time: mean area: mean where sea","None","None","None","None","down","real","longitude latitude olevel time","rsdo","ocean","mon","area: areacello","None","None",2,""
0,"Omon",2,"Heat Flux Correction","W m-2","None","If this does not vary from one year to the next, report only a single year.  Positive indicates correction adds heat to ocean.","hfcorr","heat_flux_correction","None","W m-2","time: mean area: mean where sea","None","None","None","None","down","real","longitude latitude time","hfcorr","ocean","mon","area: areacello","None","None",1,1
0,"Omon",2,"Surface Downward X Stress","N m-2","This is the stress on the liquid ocean from overlying atmosphere, sea ice, ice shelf, etc.","None","tauuo","surface_downward_x_stress","None","N m-2","time: mean area: mean where sea","None","None","None","None","down","real","longitude latitude time","tauuo","ocean","mon","None","None","None",1,1
0,"Omon",2,"Surface Downward Y Stress","N m-2","This is the stress on the liquid ocean from overlying atmosphere, sea ice, ice shelf, etc.","None","tauvo","surface_downward_y_stress","None","N m-2","time: mean area: mean where sea","None","None","None","None","down","real","longitude latitude time","tauvo","ocean","mon","None","None","None",1,1
0,"Omon",2,"Surface Downward X Stress Correction","N m-2","This is the stress on the liquid ocean from overlying atmosphere, sea ice, ice shelf, etc.","If this does not vary from one year to the next, report only a single year.","tauucorr","surface_downward_x_stress_correction","None","N m-2","time: mean area: mean where sea","None","None","None","None","down","real","longitude latitude time","tauucorr","ocean","mon","None","None","None",1,1
0,"Omon",2,"Surface Downward Y Stress Correction","N m-2","This is the stress on the liquid ocean from overlying atmosphere, sea ice, ice shelf, etc.","If this does not vary from one year to the next, report only a single year.","tauvcorr","surface_downward_y_stress_correction","None","N m-2","time: mean area: mean where sea","None","None","None","None","down","real","longitude latitude time","tauvcorr","ocean","mon","None","None","None",1,1
0,"Lmon",2,"Precipitation onto Canopy","kg m-2 s-1","the precipitation flux that is intercepted by the vegetation canopy (if present in model) before reaching the ground.","None","prveg","precipitation_flux_onto_canopy","None","kg m-2 s-1","time: mean area: mean where land","None","None","None","None","None","real","longitude latitude time","prveg","land","mon","area: areacella","None","None","",""
0,"Lmon",2,"Temperature of Soil","K","Temperature of each soil layer.  Reported as ""missing"" for grid cells occupied entirely by ""sea"".","If soil layer thicknesses vary from one location to another, interpolate to a standard set of depths.  Ideally, the interpolation should preserve the vertical integral.","tsl","soil_temperature","None","K","time: mean","None","None","None","None","None","real","longitude latitude sdepth time","tsl","land","mon","area: areacella","None","None","",""
0,"Lmon",2,"Plant Functional Type Grid Fraction","%","The categories may differ from model to model, depending on their  PFT definitions.   This may include natural PFTs, anthropogenic PFTs, bare soil, lakes, urban areas, etc.   Sum of all should equal the fraction of the grid-cell that is land.","need to explain how to define vegtype.  To facilitate model comparison, it is also requested that the aggregated land cover types called for in lines 28 to 35 be archived (but not in this variable).  Note that if this variable is independent of time, it should be stored only for a single time (of the user's choosing).   Note that the ""types"" will be model dependent and for each type there should be a full description of the PFT (plant functional type).","landCoverFrac","area_fraction","None","%","time: mean","None","None","None","None","None","real","longitude latitude vegtype time","landCoverFrac","land","mon","area: areacella","None","None","",""
0,"Lmon",2,"Total Primary Deciduous Tree Fraction","%","This is the fraction of the entire grid cell  that is covered by ""total primary deciduous trees.""","Agregation of model PFTs as defined in 1st priority to aid model intercomparison.  Note that if this variable is independent of time, it should be stored only for a single time (of the user's choosing).","treeFracPrimDec","area_fraction","None","%","time: mean","None","None","None","None","None","real","longitude latitude time typepdec","treeFracPrimDec","land","mon","area: areacella","None","None","",""
0,"Lmon",2,"Total Primary Evergreen Tree Cover Fraction","%","fraction of entire grid cell  that is covered by primary evergreen trees.","Note that if this variable is independent of time, it should be stored only for a single time (of the user's choosing).","treeFracPrimEver","area_fraction","None","%","time: mean","None","None","None","None","None","real","longitude latitude time typepever","treeFracPrimEver","land","mon","area: areacella","None","None","",""
0,"Lmon",2,"Total Secondary Deciduous Tree Cover Fraction","%","fraction of entire grid cell  that is covered by secondary deciduous trees.","Note that if this variable is independent of time, it should be stored only for a single time (of the user's choosing).","treeFracSecDec","area_fraction","None","%","time: mean","None","None","None","None","None","real","longitude latitude time typesdec","treeFracSecDec","land","mon","area: areacella","None","None","",""
0,"Lmon",2,"Total Secondary Evergreen Tree Cover Fraction","%","fraction of entire grid cell  that is covered by secondary evergreen trees.","Note that if this variable is independent of time, it should be stored only for a single time (of the user's choosing).","treeFracSecEver","area_fraction","None","%","time: mean","None","None","None","None","None","real","longitude latitude time typesever","treeFracSecEver","land","mon","area: areacella","None","None","",""
0,"Lmon",2,"Total C3 PFT Cover Fraction","%","fraction of entire grid cell  that is covered by C3 PFTs (including grass, crops, and trees).","Note that if this variable is independent of time, it should be stored only for a single time (of the user's choosing).","c3PftFrac","area_fraction","None","%","time: mean","None","None","None","None","None","real","longitude latitude time typec3pft","c3PftFrac","land","mon","area: areacella","None","None","",""
0,"Lmon",2,"Total C4 PFT Cover Fraction","%","fraction of entire grid cell  that is covered by C4 PFTs (including grass and crops).","Note that if this variable is independent of time, it should be stored only for a single time (of the user's choosing).","c4PftFrac","area_fraction","None","%","time: mean","None","None","None","None","None","real","longitude latitude time typec4pft","c4PftFrac","land","mon","area: areacella","None","None","",""
0,"LImon",2,"Liquid Water Content of Snow Layer","kg m-2","where land over land: this is computed as the total mass of liquid water contained interstitially within the snow layer of the land portion of a grid cell divided by the area of the land portion of the cell.","None","lwsnl","liquid_water_content_of_snow_layer","None","kg m-2","time: mean area: mean where land","None","None","None","None","None","real","longitude latitude time","lwsnl","landIce land","mon","area: areacella","None","None","",""
0,"LImon",2,"Snow Soot Content","kg m-2","the entire land portion of the grid cell is considered, with snow soot content set to 0.0 in regions free of snow.","None","sootsn","soot_content_of_surface_snow","None","kg m-2","time: mean area: mean where land","None","None","None","None","None","real","longitude latitude time","sootsn","landIce land","mon","area: areacella","None","None","",""
0,"OImon",2,"Surface Snow Area Fraction","%","Fraction of entire grid cell covered by snow that lies on sea ice; exclude snow that lies on land or land ice.","None","snc","surface_snow_area_fraction","None","%","time: mean","None","None","None","None","None","real","longitude latitude time","snc","seaIce","mon","area: areacello","None","None","",""
0,"OImon",2,"Sea Ice Heat Content","J m-2","Ice at 0 Celsius is assumed taken to have a heat content of 0 J.  When averaging over time, this quantity is weighted by the mass of sea ice.   Reported as ""missing in regions free of sea ice.  Does not include heat content of snow.","None","hcice","integral_of_sea_ice_temperature_wrt_depth_expressed_as_heat_content","None","J m-2","time: mean (weighted by mass of sea ice)","None","None","None","None","None","real","longitude latitude time","hcice","seaIce","mon","area: areacello","None","None","",""
0,"OImon",2,"Downwelling Long Wave over Sea Ice","W m-2","the downwelling longwave flux in regions of sea ice divided by the area of the ocean portion of the grid cell.","None","rldssi","surface_downwelling_longwave_flux_in_air","None","W m-2","time: mean area: mean where sea_ice over sea","None","None","None","None","down","real","longitude latitude time","rldssi","seaIce","mon","area: areacello","None","None","",""
0,"OImon",2,"Upward Long Wave over Sea Ice","W m-2","the upward longwave flux in regions of sea ice divided by the area of the ocean portion of the grid cell.","None","rlussi","surface_upwelling_longwave_flux_in_air","None","W m-2","time: mean area: mean where sea_ice over sea","None","None","None","None","up","real","longitude latitude time","rlussi","seaIce","mon","area: areacello","None","None","",""
0,"OImon",2,"Surface Upward Sensible Heat Flux over Sea Ice","W m-2","the upward sensible heat flux in regions of sea ice divided by the area of the ocean portion of the grid cell.","None","hfssi","surface_upward_sensible_heat_flux","None","W m-2","time: mean area: mean where sea_ice over sea","None","None","None","None","up","real","longitude latitude time","hfssi","seaIce","mon","area: areacello","None","None","",""
0,"OImon",2,"Surface Upward Latent Heat Flux over Sea Ice","W m-2","the upward latent heat flux in regions of sea ice divided by the area of the ocean portion of the grid cell.","None","hflssi","surface_upward_latent_heat_flux","None","W m-2","time: mean area: mean where sea_ice over sea","None","None","None","None","up","real","longitude latitude time","hflssi","seaIce","mon","area: areacello","None","None","",""
0,"OImon",2,"Sublimation over Sea Ice","kg m-2 s-1","the upward flux of water vapor to the atmosphere due to sublimation of snow and sea  ice in regions of sea ice divided by the area of the ocean portion of the grid cell.","None","sblsi","surface_snow_and_ice_sublimation_flux","None","kg m-2 s-1","time: mean area: mean where sea_ice over sea","None","None","None","None","up","real","longitude latitude time","sblsi","seaIce","mon","area: areacello","None","None","",""
0,"OImon",2,"Sea Ice Mass Transport Through Fram Strait","kg s-1","None","None","transifs","sea_ice_transport_across_line","None","kg s-1","time: mean","None","None","None","None","None","real","time","transifs","seaIce","mon","None","None","None","",""
0,"OImon",2,"X-Component of Atmospheric Stress On Sea Ice","N m-2","When computing the time-mean here, the time samples, weighted by the area of sea ice, are accumulated and then divided by the sum of the weights.   Reported as ""missing"" in regions free of sea ice.","None","strairx","surface_downward_x_stress","None","N m-2","time: mean (weighted by area of sea ice)","None","None","None","None","down","real","longitude latitude time","strairx","seaIce","mon","None","None","None","",""
0,"OImon",2,"Y-Component of Atmospheric Stress On Sea Ice","N m-2","When computing the time-mean here, the time samples, weighted by the area of sea ice, are accumulated and then divided by the sum of the weights.   Reported as ""missing"" in regions free of sea ice.","None","strairy","surface_downward_y_stress","None","N m-2","time: mean (weighted by area of sea ice)","None","None","None","None","down","real","longitude latitude time","strairy","seaIce","mon","None","None","None","",""
0,"OImon",2,"X-Component of Ocean Stress On Sea Ice","N m-2","When computing the time-mean here, the time samples, weighted by the area of sea ice, are accumulated and then divided by the sum of the weights.   Report as ""missing"" in regions free of sea ice.","None","strocnx","upward_x_stress_at_sea_ice_base","None","N m-2","time: mean (weighted by area of sea ice)","None","None","None","None","None","real","longitude latitude time","strocnx","seaIce ocean","mon","None","None","None","",""
0,"OImon",2,"Y-Component of Ocean Stress On Sea Ice","N m-2","When computing the time-mean here, the time samples, weighted by the area of sea ice, are accumulated and then divided by the sum of the weights.   Reported as ""missing"" in regions free of sea ice.","None","strocny","upward_y_stress_at_sea_ice_base","None","N m-2","time: mean (weighted by area of sea ice)","None","None","None","None","None","real","longitude latitude time","strocny","seaIce ocean","mon","None","None","None","",""
0,"OImon",2,"Compressive Sea Ice Strength","N m-1","When computing the time-mean here, the time samples, weighted by the area of sea ice, are accumulated and then divided by the sum of the weights.   Reported as ""missing"" in regions free of sea ice.","None","streng","compressive_strength_of_sea_ice","None","N m-1","time: mean (weighted by area of sea ice)","None","None","None","None","None","real","longitude latitude time","streng","seaIce","mon","area: areacello","None","None","",""
0,"OImon",2,"Strain Rate Divergence of Sea Ice","s-1","When computing the time-mean here, the time samples, weighted by the area of sea ice, are accumulated and then divided by the sum of the weights.   Reported as ""missing"" in regions free of sea ice.","None","divice","divergence_of_sea_ice_velocity","None","s-1","time: mean (weighted by area of sea ice)","None","None","None","None","None","real","longitude latitude time","divice","seaIce","mon","area: areacello","None","None","",""
0,"OImon",2,"Eastward Derivative of Northward Sea Ice Velocity","s-1","When computing the time-mean here, the time samples, weighted by the area of sea ice, are accumulated and then divided by the sum of the weights.   Reported as ""missing"" in regions free of sea ice.","None","eshrice","eastward_derivative_of_northward_sea_ice_velocity","None","s-1","time: mean (weighted by area of sea ice)","None","None","None","None","None","real","longitude latitude time","eshrice","seaIce","mon","area: areacello","None","None","",""
0,"OImon",2,"Northward Derivative of Eastward Sea Ice Velocity","s-1","When computing the time-mean here, the time samples, weighted by the area of sea ice, are accumulated and then divided by the sum of the weights.   Reported as ""missing"" in regions free of sea ice.","None","nshrice","northward_derivative_of_eastward_sea_ice_velocity","None","s-1","time: mean (weighted by area of sea ice)","None","None","None","None","None","real","longitude latitude time","nshrice","seaIce","mon","area: areacello","None","None","",""
0,"OImon",2,"Sea Ice Ridging Rate","s-1","When computing the time-mean here, the time samples, weighted by the area of sea ice, are accumulated and then divided by the sum of the weights.   Reported as ""missing"" in regions free of sea ice.","None","ridgice","tendency_of_sea_ice_area_fraction_due_to_ridging","None","s-1","time: mean (weighted by area of sea ice)","None","None","None","None","None","real","longitude latitude time","ridgice","seaIce","mon","area: areacello","None","None","",""
0,"aero",2,"Ambient Aerosol Optical Thickness at 870 nm",1,"AOD from the ambient aerosls (i.e., includes aerosol water).  Does not include AOD from stratospheric aerosols if these are prescribed but includes other possible background aerosol types.","None","od870aer","atmosphere_optical_thickness_due_to_ambient_aerosol","None",1,"time: mean","None","None","None","None","None","real","longitude latitude time","od870aer","aerosol","mon","area: areacella","None","None","",""
0,"aero",2,"Surface Diffuse Downwelling Shortwave Radiation","W m-2","None","None","rsdsdiff","surface_diffuse_downwelling_shortwave_flux_in_air","None","W m-2","time: mean","None","None","None","None","None","real","longitude latitude time","rsdsdiff","aerosol land","mon","area: areacella","None","None","",""
0,"aero",2,"Surface Diffuse Downwelling Clear Sky Shortwave Radiation","W m-2","None","None","rsdscsdiff","surface_diffuse_downwelling_shortwave_flux_in_air_assuming_clear_sky","None","W m-2","time: mean","None","None","None","None","None","real","longitude latitude time","rsdscsdiff","aerosol land","mon","area: areacella","None","None","",""
0,"day",2,"Geopotential Height","m","None","None","zg","geopotential_height","None","m","time: mean","None","None","None","None","None","real","longitude latitude plev8 time","zg","atmos","day","area: areacella","None","None","",""
0,"cfMon",2,"Convective Cloud Area Fraction","%","None","None","clc","convective_cloud_area_fraction_in_atmosphere_layer","None","%","time: mean","None","None","None","None","None","real","longitude latitude alevel time","clc","atmos","mon","area: areacella","None","None","",""
0,"cfMon",2,"Mass Fraction of Convective Cloud Liquid Water",1,"Calculated as the mass of convective cloud liquid water in the grid cell divided by the mass of air (including the water in all phases) in the grid cell.  This includes precipitating hydrometeors ONLY if the precipitating hydrometeors affect the calculation of radiative transfer in model.","None","clwc","mass_fraction_of_convective_cloud_liquid_water_in_air","None",1,"time: mean","None","None","None","None","None","real","longitude latitude alevel time","clwc","atmos","mon","area: areacella","None","None","",""
0,"cfMon",2,"Mass Fraction of Convective Cloud Ice",1,"Calculated as the mass of convective cloud ice  in the grid cell divided by the mass of air (including the water in all phases) in the grid cell.  This includes precipitating hydrometeors ONLY if the precipitating hydrometeors affect the calculation of radiative transfer in model.","None","clic","mass_fraction_of_convective_cloud_ice_in_air","None",1,"time: mean","None","None","None","None","None","real","longitude latitude alevel time","clic","atmos","mon","area: areacella","None","None","",""
0,"cfMon",2,"Stratiform Cloud Area Fraction","%","None","None","cls","stratiform_cloud_area_fraction_in_atmosphere_layer","None","%","time: mean","None","None","None","None","None","real","longitude latitude alevel time","cls","atmos","mon","area: areacella","None","None","",""
0,"cfMon",2,"Mass Fraction of Stratiform Cloud Liquid Water",1,"Calculated as the mass of stratiform cloud liquid water in the grid cell divided by the mass of air (including the water in all phases) in the grid cell.  This includes precipitating hydrometeors ONLY if the precipitating hydrometeors affect the calculation of radiative transfer in model.","None","clws","mass_fraction_of_stratiform_cloud_liquid_water_in_air","None",1,"time: mean","None","None","None","None","None","real","longitude latitude alevel time","clws","atmos","mon","area: areacella","None","None","",""
0,"cfMon",2,"Mass Fraction of Stratiform Cloud Ice",1,"Calculated as the mass of stratiform cloud ice  in the grid cell divided by the mass of air (including the water in all phases) in the grid cell.  This includes precipitating hydrometeors ONLY if the precipitating hydrometeors affect the calculation of radiative transfer in model.","None","clis","mass_fraction_of_stratiform_cloud_ice_in_air","None",1,"time: mean","None","None","None","None","None","real","longitude latitude alevel time","clis","atmos","mon","area: areacella","None","None","",""
0,"cfMon",2,"Updraft Convective Mass Flux","kg m-2 s-1","Calculated as the convective mass flux divided by the area of the whole grid cell (not just the area of the cloud).","Report on model half-levels (i.e., model layer bounds and not standard pressures).","mcu","atmosphere_updraft_convective_mass_flux","None","kg m-2 s-1","time: mean","None","None","None","None","up","real","longitude latitude alevhalf time","mcu","atmos","mon","area: areacella","None","None","",""
0,"cfMon",2,"Downdraft Convective Mass Flux","kg m-2 s-1","Calculated as the convective mass flux divided by the area of the whole grid cell (not just the area of the cloud).","Report on model half-levels (i.e., model layer bounds and not standard pressures).","mcd","atmosphere_downdraft_convective_mass_flux","None","kg m-2 s-1","time: mean","None","None","None","None","down","real","longitude latitude alevhalf time","mcd","atmos","mon","area: areacella","None","None","",""
